{
  "$schema": "https://json-schema.org/draft/2020-12/schema",
  "$id": "https://github.com/Lossop1/ethercat-master/apps/fingerprint/fingerprint.schema.json",
  "title": "EtherCAT 物理网络指纹",
  "type": "object",
  "additionalProperties": false,
  "required": [
    "schema_version",
    "tool",
    "captured_at_utc",
    "interface",
    "deployment_id",
    "topology_id",
    "slave_count",
    "slaves",
    "behavior"
  ],
  "properties": {
    "schema_version": {"const": 2},
    "tool": {
      "type": "object",
      "additionalProperties": false,
      "required": ["name", "version", "soem_revision"],
      "properties": {
        "name": {"const": "emaster-fingerprint"},
        "version": {"type": "string", "minLength": 1},
        "soem_revision": {"type": "string", "pattern": "^[0-9a-f]{40}$"}
      }
    },
    "captured_at_utc": {"type": "string"},
    "interface": {"type": "string", "minLength": 1},
    "deployment_id": {"type": "string", "minLength": 1},
    "topology_id": {"type": "string", "minLength": 1},
    "slave_count": {"type": "integer", "minimum": 1, "maximum": 200},
    "slaves": {
      "type": "array",
      "minItems": 1,
      "items": {"$ref": "#/$defs/slave"}
    },
    "behavior": {
      "type": "object",
      "additionalProperties": false,
      "required": [
        "pdo_mapping_performed",
        "dc_configuration_performed",
        "highest_requested_state",
        "restore_init_succeeded"
      ],
      "properties": {
        "pdo_mapping_performed": {"const": false},
        "dc_configuration_performed": {"const": false},
        "highest_requested_state": {"const": "PRE-OP"},
        "restore_init_succeeded": {"type": "boolean"}
      }
    }
  },
  "$defs": {
    "uint32": {"type": "integer", "minimum": 0, "maximum": 4294967295},
    "uint16": {"type": "integer", "minimum": 0, "maximum": 65535},
    "sdo_read": {
      "type": "object",
      "additionalProperties": false,
      "required": ["index", "subindex", "name", "type", "ok"],
      "properties": {
        "index": {"type": "string", "pattern": "^0x[0-9A-F]{4}$"},
        "subindex": {"type": "integer", "minimum": 0, "maximum": 255},
        "name": {"type": "string", "minLength": 1},
        "type": {"enum": ["u8", "i8", "u16", "u32", "string"]},
        "ok": {"type": "boolean"},
        "value": {"type": ["integer", "string"]}
      },
      "allOf": [
        {
          "if": {"properties": {"ok": {"const": true}}},
          "then": {"required": ["value"]}
        },
        {
          "if": {"properties": {"ok": {"const": false}}},
          "then": {"not": {"required": ["value"]}}
        }
      ]
    },
    "pdo_entry": {
      "type": "object",
      "additionalProperties": false,
      "required": [
        "mapping_subindex",
        "raw_descriptor",
        "object_index",
        "object_subindex",
        "bit_length",
        "bit_offset",
        "data_type",
        "name"
      ],
      "properties": {
        "mapping_subindex": {"type": "integer", "minimum": 1, "maximum": 255},
        "raw_descriptor": {"type": "string", "pattern": "^0x[0-9A-F]{8}$"},
        "object_index": {"type": "string", "pattern": "^0x[0-9A-F]{4}$"},
        "object_subindex": {"type": "integer", "minimum": 0, "maximum": 255},
        "bit_length": {"type": "integer", "minimum": 1, "maximum": 255},
        "bit_offset": {"type": "integer", "minimum": 0, "maximum": 4294967295},
        "data_type": {"type": "string", "minLength": 1},
        "name": {"type": "string", "minLength": 1}
      }
    },
    "pdo_mapping": {
      "type": "object",
      "additionalProperties": false,
      "required": [
        "assignment_subindex",
        "mapping_index",
        "entry_count",
        "bit_length",
        "entries"
      ],
      "properties": {
        "assignment_subindex": {"type": "integer", "minimum": 1, "maximum": 255},
        "mapping_index": {"type": "string", "pattern": "^0x[0-9A-F]{4}$"},
        "entry_count": {"type": "integer", "minimum": 0, "maximum": 255},
        "bit_length": {"type": "integer", "minimum": 0, "maximum": 4294967295},
        "entries": {
          "type": "array",
          "maxItems": 255,
          "items": {"$ref": "#/$defs/pdo_entry"}
        }
      }
    },
    "pdo_direction": {
      "type": "object",
      "additionalProperties": false,
      "required": [
        "assignment_index",
        "mapping_count",
        "bit_length",
        "byte_length",
        "mappings"
      ],
      "properties": {
        "assignment_index": {"type": "string", "pattern": "^0x1C1[23]$"},
        "mapping_count": {"type": "integer", "minimum": 0, "maximum": 255},
        "bit_length": {"type": "integer", "minimum": 0, "maximum": 4294967295},
        "byte_length": {"type": "integer", "minimum": 0, "maximum": 536870912},
        "mappings": {
          "type": "array",
          "maxItems": 255,
          "items": {"$ref": "#/$defs/pdo_mapping"}
        }
      }
    },
    "pdo_layout": {
      "type": "object",
      "additionalProperties": false,
      "required": ["status", "rx", "tx"],
      "properties": {
        "status": {"const": "complete"},
        "rx": {"$ref": "#/$defs/pdo_direction"},
        "tx": {"$ref": "#/$defs/pdo_direction"}
      }
    },
    "slave": {
      "type": "object",
      "additionalProperties": false,
      "required": [
        "position",
        "name",
        "sii_identity",
        "state",
        "has_dc",
        "has_coe",
        "target_profile_id",
        "target_profile_match",
        "target_pdo_match",
        "pdo_layout",
        "sdo_reads"
      ],
      "properties": {
        "position": {"type": "integer", "minimum": 1, "maximum": 200},
        "name": {"type": "string"},
        "sii_identity": {
          "type": "object",
          "additionalProperties": false,
          "required": ["vendor_id", "product_code", "revision"],
          "properties": {
            "vendor_id": {"$ref": "#/$defs/uint32"},
            "product_code": {"$ref": "#/$defs/uint32"},
            "revision": {"$ref": "#/$defs/uint32"}
          }
        },
        "state": {"type": "integer", "minimum": 0, "maximum": 65535},
        "has_dc": {"type": "boolean"},
        "has_coe": {"type": "boolean"},
        "mbx_rl": {"$ref": "#/$defs/uint16",
                   "description": "邮箱读写长度（SOEM 的 slave->mbx_rl）。生产者自 2026-09 起写它，更早的指纹没有这个字段，故不列入 required。"},
        "target_profile_id": {"type": "string", "minLength": 1},
        "target_profile_match": {"const": true},
        "target_pdo_match": {"const": true},
        "pdo_layout": {"$ref": "#/$defs/pdo_layout"},
        "sdo_reads": {
          "type": "array",
          "items": {"$ref": "#/$defs/sdo_read"}
        }
      }
    }
  }
}
