{
  "schema_version": 2,
  "tool": {"name": "emaster-fingerprint", "version": "0.1.0", "soem_revision": "304d1c05eab77dc0d426f1a5cf09c8cc7dc03713"},
  "captured_at_utc": "2026-09-01T03:41:52Z",
  "interface": "enp49s0",
  "deployment_id": "orangepi-current-bench",
  "topology_id": "bench-current-single-slave",
  "slave_count": 1,
  "slaves": [
    {"position":1,"name":"Robot_Joint_Actuator","sii_identity":{"vendor_id":789248,"product_code":524567,"revision":1},"state":2,"has_dc":true,"has_coe":true,"target_profile_id":"cyberbeast.isvd90rc-300b-100-70.rev1","target_profile_match":true,"target_pdo_match":true,"pdo_layout":{"status":"complete","rx":{"assignment_index":"0x1C12","mapping_count":1,"bit_length":112,"byte_length":14,"mappings":[{"assignment_subindex":1,"mapping_index":"0x1600","entry_count":6,"bit_length":112,"entries":[{"mapping_subindex":1,"raw_descriptor":"0x60400010","object_index":"0x6040","object_subindex":0,"bit_length":16,"bit_offset":0,"data_type":"UINT","name":"control_word"},{"mapping_subindex":2,"raw_descriptor":"0x607A0020","object_index":"0x607A","object_subindex":0,"bit_length":32,"bit_offset":16,"data_type":"DINT","name":"target_position"},{"mapping_subindex":3,"raw_descriptor":"0x60FF0020","object_index":"0x60FF","object_subindex":0,"bit_length":32,"bit_offset":48,"data_type":"DINT","name":"target_velocity"},{"mapping_subindex":4,"raw_descriptor":"0x60710010","object_index":"0x6071","object_subindex":0,"bit_length":16,"bit_offset":80,"data_type":"INT","name":"target_torque"},{"mapping_subindex":5,"raw_descriptor":"0x60600008","object_index":"0x6060","object_subindex":0,"bit_length":8,"bit_offset":96,"data_type":"SINT","name":"mode_of_operation"},{"mapping_subindex":6,"raw_descriptor":"0x00000008","object_index":"0x0000","object_subindex":0,"bit_length":8,"bit_offset":104,"data_type":"PADDING","name":"padding"}]}]},"tx":{"assignment_index":"0x1C13","mapping_count":1,"bit_length":112,"byte_length":14,"mappings":[{"assignment_subindex":1,"mapping_index":"0x1A00","entry_count":6,"bit_length":112,"entries":[{"mapping_subindex":1,"raw_descriptor":"0x60410010","object_index":"0x6041","object_subindex":0,"bit_length":16,"bit_offset":0,"data_type":"UINT","name":"status_word"},{"mapping_subindex":2,"raw_descriptor":"0x60640020","object_index":"0x6064","object_subindex":0,"bit_length":32,"bit_offset":16,"data_type":"DINT","name":"actual_position"},{"mapping_subindex":3,"raw_descriptor":"0x606C0020","object_index":"0x606C","object_subindex":0,"bit_length":32,"bit_offset":48,"data_type":"DINT","name":"actual_velocity"},{"mapping_subindex":4,"raw_descriptor":"0x60770010","object_index":"0x6077","object_subindex":0,"bit_length":16,"bit_offset":80,"data_type":"INT","name":"actual_torque"},{"mapping_subindex":5,"raw_descriptor":"0x60610008","object_index":"0x6061","object_subindex":0,"bit_length":8,"bit_offset":96,"data_type":"SINT","name":"mode_display"},{"mapping_subindex":6,"raw_descriptor":"0x00000008","object_index":"0x0000","object_subindex":0,"bit_length":8,"bit_offset":104,"data_type":"PADDING","name":"padding"}]}]}},"sdo_reads":[{"index":"0x1008","subindex":0,"name":"device_name","type":"string","ok":true,"value":"ISVD90RC-300B-100-70"},{"index":"0x1009","subindex":0,"name":"hardware_version","type":"string","ok":true,"value":"v8.1.23"},{"index":"0x100A","subindex":0,"name":"software_version","type":"string","ok":true,"value":"0.6.0"},{"index":"0x1018","subindex":1,"name":"identity_vendor_id","type":"u32","ok":true,"value":789248},{"index":"0x1018","subindex":2,"name":"identity_product_code","type":"u32","ok":true,"value":524567},{"index":"0x1018","subindex":3,"name":"identity_revision","type":"u32","ok":true,"value":1},{"index":"0x1018","subindex":4,"name":"identity_serial_number","type":"u32","ok":true,"value":0},{"index":"0x10F1","subindex":2,"name":"sync_error_counter_limit","type":"u16","ok":true,"value":4},{"index":"0x1C32","subindex":1,"name":"sm2_sync_type","type":"u16","ok":true,"value":0},{"index":"0x1C32","subindex":2,"name":"sm2_cycle_time_ns","type":"u32","ok":true,"value":0},{"index":"0x1C32","subindex":4,"name":"sm2_supported_sync_types","type":"u16","ok":true,"value":16415},{"index":"0x1C32","subindex":5,"name":"sm2_minimum_cycle_time_ns","type":"u32","ok":true,"value":31200},{"index":"0x1C32","subindex":10,"name":"sm2_sync0_cycle_time_ns","type":"u32","ok":true,"value":0},{"index":"0x1C32","subindex":11,"name":"sm2_event_missed_count","type":"u16","ok":true,"value":0},{"index":"0x1C32","subindex":12,"name":"sm2_cycle_too_small_count","type":"u16","ok":true,"value":0},{"index":"0x1C32","subindex":13,"name":"sm2_shift_too_short_count","type":"u16","ok":true,"value":0},{"index":"0x1C32","subindex":32,"name":"sm2_sync_error","type":"u8","ok":true,"value":0},{"index":"0x1C33","subindex":1,"name":"sm3_sync_type","type":"u16","ok":true,"value":0},{"index":"0x1C33","subindex":2,"name":"sm3_cycle_time_ns","type":"u32","ok":true,"value":0},{"index":"0x1C33","subindex":4,"name":"sm3_supported_sync_types","type":"u16","ok":true,"value":16415},{"index":"0x1C33","subindex":5,"name":"sm3_minimum_cycle_time_ns","type":"u32","ok":true,"value":31200},{"index":"0x1C33","subindex":10,"name":"sm3_sync0_cycle_time_ns","type":"u32","ok":true,"value":0},{"index":"0x1C33","subindex":11,"name":"sm3_event_missed_count","type":"u16","ok":true,"value":0},{"index":"0x1C33","subindex":12,"name":"sm3_cycle_too_small_count","type":"u16","ok":true,"value":0},{"index":"0x1C33","subindex":13,"name":"sm3_shift_too_short_count","type":"u16","ok":true,"value":0},{"index":"0x1C33","subindex":32,"name":"sm3_sync_error","type":"u8","ok":true,"value":0},{"index":"0x2002","subindex":1,"name":"input_mode","type":"u16","ok":true,"value":5},{"index":"0x603F","subindex":0,"name":"error_code","type":"u16","ok":true,"value":0},{"index":"0x6060","subindex":0,"name":"mode_of_operation","type":"i8","ok":true,"value":0},{"index":"0x6075","subindex":0,"name":"motor_rated_current","type":"u32","ok":true,"value":10000},{"index":"0x6076","subindex":0,"name":"motor_rated_torque","type":"u32","ok":true,"value":10000},{"index":"0x608F","subindex":1,"name":"encoder_increments","type":"u32","ok":true,"value":16384},{"index":"0x608F","subindex":2,"name":"encoder_motor_revolutions","type":"u32","ok":true,"value":1},{"index":"0x6091","subindex":1,"name":"gear_motor_revolutions","type":"u32","ok":true,"value":28},{"index":"0x6091","subindex":2,"name":"gear_shaft_revolutions","type":"u32","ok":true,"value":1},{"index":"0x60C2","subindex":1,"name":"interpolation_time_period","type":"u8","ok":true,"value":1},{"index":"0x60C2","subindex":2,"name":"interpolation_time_index","type":"i8","ok":true,"value":-3},{"index":"0x6502","subindex":0,"name":"supported_drive_modes","type":"u32","ok":true,"value":896}]}
  ],
  "behavior": {"pdo_mapping_performed": false,"dc_configuration_performed": false,"highest_requested_state": "PRE-OP","restore_init_succeeded": true}
}
